{"$schema":"https://json-schema.org/draft/2020-12/schema","title":"Knowledge Relation","type":"object","required":["from","type","to","evidenceSourceIds"],"properties":{"from":{"type":"string"},"type":{"enum":["uses","implements","extends","depends-on","runs-on","compiled-by","interpreted-by","defined-by","standardized-by","suitable-for","alternative-to","influenced-by","supersedes","obsoletes","updates","related-to","compatible-with"]},"to":{"type":"string"},"confidence":{"enum":["preliminary","supported","strong"]},"locator":{"type":"string"},"evidenceSourceIds":{"type":"array","items":{"type":"string"},"minItems":1},"evidenceClaimIds":{"type":"array","items":{"type":"string"}}},"additionalProperties":false}
