[
  {"from":"concept.architecture-description","type":"defined-by","to":"standard.iso-42010-2022","confidence":"strong","locator":"Clauses 5–7","evidenceSourceIds":["source.iso-42010"],"evidenceClaimIds":["claim.architecture-description.normative"]},
  {"from":"standard.iso-42010-2022","type":"supersedes","to":"standard.iso-42010-2011","evidenceSourceIds":["source.iso-42010"]},
  {"from":"concept.rfc-lifecycle","type":"defined-by","to":"rfc.2026","confidence":"strong","locator":"Sections 4–6","evidenceSourceIds":["source.rfc2026"],"evidenceClaimIds":["claim.rfc.lifecycle"]},
  {"from":"rfc.9846","type":"obsoletes","to":"rfc.8446","evidenceSourceIds":["source.rfc-editor"]},
  {"from":"concept.ai-risk-management","type":"defined-by","to":"standard.nist-ai-rmf-1.0","confidence":"strong","locator":"AI RMF Core","evidenceSourceIds":["source.nist.ai-rmf-1"],"evidenceClaimIds":["claim.ai-risk.lifecycle"]},
  {"from":"standard.spdx-3.0","type":"suitable-for","to":"domain.software-supply-chain","evidenceSourceIds":["source.spdx.3"]},
  {"from":"architecture.modular-monolith","type":"suitable-for","to":"domain.web","evidenceSourceIds":["source.swebok-v4"]},
  {"from":"architecture.cloud-native","type":"suitable-for","to":"domain.distributed-systems","evidenceSourceIds":["source.swebok-v4"]},
  {"from":"architecture.cloud-native","type":"defined-by","to":"standard.iso-25010-2023","confidence":"strong","locator":"Section 4 Quality Attributes","evidenceSourceIds":["source.swebok-v4"]},
  {"from":"ai.llm-agents","type":"defined-by","to":"standard.nist-ai-rmf-1.0","confidence":"strong","locator":"Govern & Manage Functions","evidenceSourceIds":["source.nist.ai-rmf-1"]},
  {"from":"architecture.embedded-rtos","type":"defined-by","to":"standard.posix-1-2024","confidence":"strong","locator":"Realtime Systems Section","evidenceSourceIds":["source.swebok-v4"]},
  {"from":"architecture.game-engine","type":"suitable-for","to":"domain.game-development","evidenceSourceIds":["source.swebok-v4"]},
  {"from":"language.cpp","type":"suitable-for","to":"domain.embedded-systems","evidenceSourceIds":["source.swebok-v4"]},
  {"from":"language.go","type":"suitable-for","to":"domain.cloud-native","evidenceSourceIds":["source.swebok-v4"]},
  {"from":"architecture.cqrs-event-sourcing","type":"suitable-for","to":"domain.distributed-systems","evidenceSourceIds":["source.swebok-v4"]},
  {"from":"architecture.island-architecture","type":"suitable-for","to":"domain.web","evidenceSourceIds":["source.swebok-v4"]},
  {"from":"language.typescript","type":"defined-by","to":"standard.ecma-262-2026","confidence":"strong","locator":"Type System Extensions","evidenceSourceIds":["source.swebok-v4"]},
  {"from":"architecture.zero-trust","type":"defined-by","to":"standard.iso-25010-2023","confidence":"strong","locator":"Security Attribute Section","evidenceSourceIds":["source.swebok-v4"]},
  {"from":"architecture.supply-chain-security","type":"defined-by","to":"standard.spdx-3.0","confidence":"strong","locator":"Specification Core","evidenceSourceIds":["source.spdx.3"]},
  {"from":"language.python","type":"suitable-for","to":"domain.web","evidenceSourceIds":["source.swebok-v4"]},
  {"from":"language.python","type":"suitable-for","to":"domain.ai","evidenceSourceIds":["source.swebok-v4"]},
  {"from":"architecture.actor-model","type":"suitable-for","to":"domain.distributed-systems","evidenceSourceIds":["source.swebok-v4"]},
  {"from":"architecture.webassembly","type":"suitable-for","to":"domain.web","evidenceSourceIds":["source.swebok-v4"]},
  {"from":"architecture.cyber-security","type":"defined-by","to":"standard.iso-25010-2023","confidence":"strong","locator":"Security Attribute Section","evidenceSourceIds":["source.swebok-v4"]},
  {"from":"architecture.network-architecture","type":"suitable-for","to":"domain.cloud-native","evidenceSourceIds":["source.swebok-v4"]},
  {"from":"concept.multi-agent-systems","type":"defined-by","to":"standard.nist-ai-rmf-1.0","confidence":"strong","locator":"Govern & Manage Functions","evidenceSourceIds":["source.nist.ai-rmf-1"]},
  {"from":"protocol.oauth21-oidc","type":"defined-by","to":"standard.iso-25010-2023","confidence":"strong","locator":"Security Attribute Section","evidenceSourceIds":["source.swebok-v4"]}
]
